{
  "id": 39,
  "name": "Level_C04_S09",
  "rowCount": 5,
  "columnCount": 9,
  "processDataList": [
    {
      "id": 0,
      "row": 0,
      "column": 0,
      "slotDataList": [
        {
          "id": 0,
          "requiredColorId": 20,
          "selectionOrder": 0
        },
        {
          "id": 1,
          "requiredColorId": 23,
          "selectionOrder": 1
        },
        {
          "id": 2,
          "requiredColorId": 25,
          "selectionOrder": 2
        }
      ]
    },
    {
      "id": 4,
      "row": 0,
      "column": 4,
      "slotDataList": [
        {
          "id": 0,
          "requiredColorId": 21,
          "selectionOrder": 0
        },
        {
          "id": 1,
          "requiredColorId": 24,
          "selectionOrder": 1
        },
        {
          "id": 2,
          "requiredColorId": 25,
          "selectionOrder": 2
        }
      ]
    },
    {
      "id": 8,
      "row": 0,
      "column": 8,
      "slotDataList": [
        {
          "id": 0,
          "requiredColorId": 22,
          "selectionOrder": 0
        },
        {
          "id": 1,
          "requiredColorId": 23,
          "selectionOrder": 1
        },
        {
          "id": 2,
          "requiredColorId": 25,
          "selectionOrder": 2
        }
      ]
    }
  ],
  "resourceDataList": [
    {
      "id": 20,
      "row": 2,
      "column": 2,
      "initialColorId": 20,
      "capacity": 1,
      "ruleDataList": [
        {
          "ruleType": "ColorSwitch",
          "colorIdList": [20, 21, 22]
        }
      ]
    },
    {
      "id": 22,
      "row": 2,
      "column": 4,
      "initialColorId": 23,
      "capacity": 1,
      "ruleDataList": [
        {
          "ruleType": "ColorSwitch",
          "colorIdList": [23, 24]
        }
      ]
    },
    {
      "id": 24,
      "row": 2,
      "column": 6,
      "initialColorId": 25,
      "capacity": 2,
      "ruleDataList": [
        {
          "ruleType": "Basic"
        }
      ]
    }
  ],
  "relayDataList": [],
  "generationNotes": [
    "C04 S09 replacement revision: three process groups advance the two ColorSwitch resources through matching cycles.",
    "The lower process count preserves the intended color-order lesson while removing the excessively long queue from revision 01.",
    "The Basic resource completes each group and makes the next Switch colors visible only after a process releases both Switch resources."
  ]
}
