{
  "id": 43,
  "name": "Level_C05_S03",
  "rowCount": 3,
  "columnCount": 5,
  "processDataList": [
    {
      "id": 10,
      "row": 2,
      "column": 0,
      "slotDataList": [
        {
          "id": 0,
          "requiredColorId": 27,
          "selectionOrder": 0
        }
      ]
    },
    {
      "id": 14,
      "row": 2,
      "column": 4,
      "slotDataList": [
        {
          "id": 0,
          "requiredColorId": 27,
          "selectionOrder": 0
        }
      ]
    }
  ],
  "resourceDataList": [
    {
      "id": 7,
      "row": 1,
      "column": 2,
      "initialColorId": 28,
      "capacity": 2,
      "ruleDataList": [
        {
          "ruleType": "EmptyColor"
        }
      ]
    }
  ],
  "relayDataList": [],
  "generationNotes": [
    "C05 S03 replacement revision: two matching slots enter the EmptyColor resource together.",
    "The first shared occupancy fixes the resource to ColorId 27 without introducing queue pressure yet.",
    "Later stages introduce capacity contention and competing first-color choices."
  ]
}
